BOM.csv

Categorie;Article;Quantite;Prix_Unitaire_EUR;Prix_Total_EUR;Notes;URL
Controls;Fader;6;1.50;9.00;;https://fr.aliexpress.com/item/1005006152089336.html
Controls;Button;1;14.79;14.79;Lot de 53 boutons;https://fr.aliexpress.com/item/1005003911184656.html
Controls;ESP-WROOM-32;2;5.00;10.00;1 pour logique/DMX, 1 pour gestion des entrées;https://fr.aliexpress.com/item/1005005655238798.html
Controls;MAX485 Module RS-485;1;2.44;2.44;Lot de 2 modules;https://fr.aliexpress.com/item/1005005737922222.html
Power;Alimentation 5V 4A;1;9.59;9.59;;https://fr.aliexpress.com/item/1005008468643815.html
Power;Condensateur électrolytique 470uF 16V;1;3.99;3.99;;https://fr.aliexpress.com/item/1005009417460390.html
Power;Condensateurs céramiques 100nF 50V (20 pcs);1;6.09;6.09;;https://fr.aliexpress.com/item/1005012122696428.html
Power;Interrupteur ON/OFF;1;1.13;1.13;;https://fr.aliexpress.com/item/1005010015277754.html
Power;Résistance 1kΩ;1;4.39;4.39;;https://fr.aliexpress.com/item/1005011813359681.html
Power;Résistance 10kΩ;1;5.19;5.19;;https://fr.aliexpress.com/item/1005011813359681.html
Power;Résistance 120Ω;1;5.19;5.19;;https://fr.aliexpress.com/item/1005011813359681.html
Power;Diodes (100 pcs);1;0.94;0.94;;https://fr.aliexpress.com/item/1005002339916163.html
Power;Connecteurs XLR 3 broches;1;4.19;4.19;Lot de 4 connecteurs;
Power;Jack alimentation DC;1;1.23;1.23;;https://fr.aliexpress.com/item/1005011863804603.html
Power;Porte-fusible panneau;1;1.79;1.79;Lot de 10;
Power;Fusible verre 250V 2A;1;1.96;1.96;;
Prototype;Plaque de prototypage PCB;1;3.19;3.19;; 
Prototype;Fil électrique;1;2.79;2.79;;https://fr.aliexpress.com/item/1005006996255957.html
Prototype;Étain de soudure;1;4.59;4.59;;https://fr.aliexpress.com/item/1005009973086759.html
Prototype;Gaine thermorétractable;1;2.19;2.19;Kit 164 pcs;
Impression;PLA 1 kg;1;15.99;15.99;;https://fr.aliexpress.com/item/1005007175412873.html
TOTAL;;; ;115.94;;

JOURNAL.md

# May 31: Reflection about product

For controll:
- 2x ESP-WROOM-32 (https://fr.aliexpress.com/item/1005005655238798.html) = 2*5€
  -> One for logic and generate DMX
  -> One for manage inputs
- 2x  MAX485 Module RS-485 (https://fr.aliexpress.com/item/1005005737922222.html) = 1*2.44€

For power:
- Power 5V 4A (https://fr.aliexpress.com/item/1005008468643815.html) = 1 * 9,59€
- Electrolytic Capacitor (470uF 16V) (https://fr.aliexpress.com/item/1005009417460390.html) = 1 * 3,99€
- 20Pcs Ceramic capacitor 50V (100nF 50V) (https://fr.aliexpress.com/item/1005012122696428.html) = 1 * 6,09€
- ON-Off Toggle Switch (https://fr.aliexpress.com/item/1005010015277754.html) = 1 * 1.13€
- 1k Ohm (https://fr.aliexpress.com/item/1005011813359681.html) = 1 * 4,39€
- 10k Ohm (https://fr.aliexpress.com/item/1005011813359681.html) = 1 * 5.19€
- 120 Ohm (https://fr.aliexpress.com/item/1005011813359681.html) = 1 * 5.19€
- 100 x Diode (https://fr.aliexpress.com/item/1005002339916163.html) = 1 * 0,94€
- XLR 3Pin Panel Mount Connectors (4PCS XLR 3Pin Panel Mount Connectors Male/Female Durable Metal Housing Silver Jack for Pro Audio Mic Speaker) = 1 * 4.19€
- DC Power Jack (https://fr.aliexpress.com/item/1005011863804603.html) = 1 * 1,23€
- Panel Mount Fuse (10pcs/lot Panel Mount PCB Fuse Holder Case with transparent Cover 5x20mm 250V) = 1 * 1.79€
- Glass Fuse 250V 2A = 1 * 1.96€

Proto:
- PCB Circuit Prototyping Board (PCB Circuit Prototyping Board Double Side Prototype Boards DIY Universal Printed Perfboard Electronic Kit) = 1 * 4.79€
- Wire (https://fr.aliexpress.com/item/1005003269498051.html) = 1 * 3.99€

# June 8: Recap all my docs for see where I go

For controll:
- 2x ESP-WROOM-32 (https://fr.aliexpress.com/item/1005005655238798.html) = 2*5€ = 10€
  -> One for logic and generate DMX
  -> One for manage inputs
- 2x  MAX485 Module RS-485 (https://fr.aliexpress.com/item/1005005737922222.html) = 1*2.44€

For power:
- Power 5V 4A (https://fr.aliexpress.com/item/1005008468643815.html) = 1 * 9,59€
- Electrolytic Capacitor (470uF 16V) (https://fr.aliexpress.com/item/1005009417460390.html) = 1 * 3,99€
- 20Pcs Ceramic capacitor 50V (100nF 50V) (https://fr.aliexpress.com/item/1005012122696428.html) = 1 * 6,09€
- ON-Off Toggle Switch (https://fr.aliexpress.com/item/1005010015277754.html) = 1 * 1.13€
- 1k Ohm (https://fr.aliexpress.com/item/1005011813359681.html) = 1 * 4,39€
- 10k Ohm (https://fr.aliexpress.com/item/1005011813359681.html) = 1 * 5.19€
- 120 Ohm (https://fr.aliexpress.com/item/1005011813359681.html) = 1 * 5.19€
- 100 x Diode (https://fr.aliexpress.com/item/1005002339916163.html) = 1 * 0,94€
- XLR 3Pin Panel Mount Connectors (4PCS XLR 3Pin Panel Mount Connectors Male/Female Durable Metal Housing Silver Jack for Pro Audio Mic Speaker) = 1 * 4.19€
- DC Power Jack (https://fr.aliexpress.com/item/1005011863804603.html) = 1 * 1,23€
- Panel Mount Fuse (10pcs/lot Panel Mount PCB Fuse Holder Case with transparent Cover 5x20mm 250V) = 1 * 1.79€
- Glass Fuse 250V 2A = 1 * 1.96€